root@comp3134Winter2023:~# tcpdump -n -i eth0
tcpdump: verbose output suppressed, use -v or -vv for full protocol decode
listening on eth0, link-type EN10MB (Ethernet), capture size 262144 bytes
22:07:37.435112 IP 147.182.152.46.22 > 104.171.50.84.65337: Flags [P.], seq 4277653852:4277653960, ack 1758399130, win 501, options [nop,nop,TS val 3460357483 ecr 2410291600], length 108
22:07:37.435217 IP 147.182.152.46.22 > 104.171.50.84.65337: Flags [P.], seq 108:252, ack 1, win 501, options [nop,nop,TS val 3460357483 ecr 2410291600], length 144
22:07:37.435271 IP 147.182.152.46.22 > 104.171.50.84.65337: Flags [P.], seq 252:288, ack 1, win 501, options [nop,nop,TS val 3460357483 ecr 2410291600], length 36
22:07:37.435414 IP 147.182.152.46.22 > 104.171.50.84.65337: Flags [P.], seq 288:508, ack 1, win 501, options [nop,nop,TS val 3460357483 ecr 2410291600], length 220
22:07:37.435487 IP 147.182.152.46.22 > 104.171.50.84.65337: Flags [P.], seq 508:544, ack 1, win 501, options [nop,nop,TS val 3460357483 ecr 2410291600], length 36
22:07:37.435523 IP 147.182.152.46.22 > 104.171.50.84.65337: Flags [P.], seq 544:748, ack 1, win 501, options [nop,nop,TS val 3460357483 ecr 2410291600], length 204
22:07:37.435596 IP 147.182.152.46.22 > 104.171.50.84.65337: Flags [P.], seq 748:784, ack 1, win 501, options [nop,nop,TS val 3460357483 ecr 2410291600], length 36
22:07:37.435616 IP 147.182.152.46.22 > 104.171.50.84.65337: Flags [P.], seq 784:980, ack 1, win 501, options [nop,nop,TS val 3460357483 ecr 2410291600], length 196
22:07:37.435706 IP 147.182.152.46.22 > 104.171.50.84.65337: Flags [P.], seq 980:1016, ack 1, win 501, options [nop,nop,TS val 3460357483 ecr 2410291600], length 36
22:07:37.438731 IP 104.171.50.84.65337 > 147.182.152.46.22: Flags [.], ack 0, win 2047, options [nop,nop,TS val 2410291638 ecr 3460357475], length 0
22:07:37.438786 IP 147.182.152.46.22 > 104.171.50.84.65337: Flags [P.], seq 1016:2440, ack 1, win 501, options [nop,nop,TS val 3460357487 ecr 2410291638], length 1424
22:07:37.438927 IP 147.182.152.46.22 > 104.171.50.84.65337: Flags [P.], seq 2440:2628, ack 1, win 501, options [nop,nop,TS val 3460357487 ecr 2410291638], length 188
22:07:37.453698 IP 104.171.50.84.65337 > 147.182.152.46.22: Flags [.], ack 980, win 2034, options [nop,nop,TS val 2410291648 ecr 3460357483], length 0
22:07:37.453698 IP 104.171.50.84.65337 > 147.182.152.46.22: Flags [.], ack 1016, win 2047, options [nop,nop,TS val 2410291648 ecr 3460357483], length 0
22:07:37.453778 IP 147.182.152.46.22 > 104.171.50.84.65337: Flags [P.], seq 2628:3144, ack 1, win 501, options [nop,nop,TS val 3460357502 ecr 2410291648], length 516
22:07:37.453972 IP 147.182.152.46.22 > 104.171.50.84.65337: Flags [P.], seq 3144:3332, ack 1, win 501, options [nop,nop,TS val 3460357502 ecr 2410291648], length 188
22:07:37.454043 IP 147.182.152.46.22 > 104.171.50.84.65337: Flags [P.], seq 3332:3556, ack 1, win 501, options [nop,nop,TS val 3460357502 ecr 2410291648], length 224
22:07:37.454095 IP 147.182.152.46.22 > 104.171.50.84.65337: Flags [P.], seq 3556:3592, ack 1, win 501, options [nop,nop,TS val 3460357502 ecr 2410291648], length 36
22:07:37.454128 IP 147.182.152.46.22 > 104.171.50.84.65337: Flags [P.], seq 3592:3796, ack 1, win 501, options [nop,nop,TS val 3460357502 ecr 2410291648], length 204
22:07:37.454161 IP 147.182.152.46.22 > 104.171.50.84.65337: Flags [P.], seq 3796:3832, ack 1, win 501, options [nop,nop,TS val 3460357502 ecr 2410291648], length 36
22:07:37.454211 IP 147.182.152.46.22 > 104.171.50.84.65337: Flags [P.], seq 3832:4036, ack 1, win 501, options [nop,nop,TS val 3460357502 ecr 2410291648], length 204
22:07:37.454266 IP 147.182.152.46.22 > 104.171.50.84.65337: Flags [P.], seq 4036:4276, ack 1, win 501, options [nop,nop,TS val 3460357502 ecr 2410291648], length 240
22:07:37.454321 IP 147.182.152.46.22 > 104.171.50.84.65337: Flags [P.], seq 4276:4312, ack 1, win 501, options [nop,nop,TS val 3460357502 ecr 2410291648], length 36
22:07:37.454349 IP 147.182.152.46.22 > 104.171.50.84.65337: Flags [P.], seq 4312:4516, ack 1, win 501, options [nop,nop,TS val 3460357502 ecr 2410291648], length 204
22:07:37.454421 IP 147.182.152.46.22 > 104.171.50.84.65337: Flags [P.], seq 4516:4756, ack 1, win 501, options [nop,nop,TS val 3460357502 ecr 2410291648], length 240
22:07:37.454481 IP 147.182.152.46.22 > 104.171.50.84.65337: Flags [P.], seq 4756:4792, ack 1, win 501, options [nop,nop,TS val 3460357502 ecr 2410291648], length 36
22:07:37.454505 IP 147.182.152.46.22 > 104.171.50.84.65337: Flags [P.], seq 4792:4996, ack 1, win 501, options [nop,nop,TS val 3460357502 ecr 2410291648], length 204
22:07:37.454567 IP 147.182.152.46.22 > 104.171.50.84.65337: Flags [P.], seq 4996:5236, ack 1, win 501, options [nop,nop,TS val 3460357502 ecr 2410291648], length 240
22:07:37.454630 IP 147.182.152.46.22 > 104.171.50.84.65337: Flags [P.], seq 5236:5272, ack 1, win 501, options [nop,nop,TS val 3460357502 ecr 2410291648], length 36
22:07:37.454680 IP 147.182.152.46.22 > 104.171.50.84.65337: Flags [P.], seq 5272:5476, ack 1, win 501, options [nop,nop,TS val 3460357502 ecr 2410291648], length 204
22:07:37.454742 IP 147.182.152.46.22 > 104.171.50.84.65337: Flags [P.], seq 5476:5512, ack 1, win 501, options [nop,nop,TS val 3460357502 ecr 2410291648], length 36
22:07:37.454785 IP 147.182.152.46.22 > 104.171.50.84.65337: Flags [P.], seq 5512:5716, ack 1, win 501, options [nop,nop,TS val 3460357503 ecr 2410291648], length 204
22:07:37.471639 IP 104.171.50.84.65337 > 147.182.152.46.22: Flags [.], ack 5236, win 1982, options [nop,nop,TS val 2410291665 ecr 3460357502], length 0
22:07:37.471640 IP 104.171.50.84.65337 > 147.182.152.46.22: Flags [.], ack 5236, win 2048, options [nop,nop,TS val 2410291665 ecr 3460357502], length 0
22:07:37.471714 IP 147.182.152.46.22 > 104.171.50.84.65337: Flags [P.], seq 5716:7912, ack 1, win 501, options [nop,nop,TS val 3460357519 ecr 2410291665], length 2196
22:07:37.472082 IP 147.182.152.46.22 > 104.171.50.84.65337: Flags [P.], seq 7912:8100, ack 1, win 501, options [nop,nop,TS val 3460357520 ecr 2410291665], length 188
22:07:37.472251 IP 147.182.152.46.22 > 104.171.50.84.65337: Flags [P.], seq 8100:8136, ack 1, win 501, options [nop,nop,TS val 3460357520 ecr 2410291665], length 36
22:07:37.472315 IP 147.182.152.46.22 > 104.171.50.84.65337: Flags [P.], seq 8136:8324, ack 1, win 501, options [nop,nop,TS val 3460357520 ecr 2410291665], length 188
22:07:37.472365 IP 147.182.152.46.22 > 104.171.50.84.65337: Flags [P.], seq 8324:8360, ack 1, win 501, options [nop,nop,TS val 3460357520 ecr 2410291665], length 36
22:07:37.472409 IP 147.182.152.46.22 > 104.171.50.84.65337: Flags [P.], seq 8360:8564, ack 1, win 501, options [nop,nop,TS val 3460357520 ecr 2410291665], length 204
22:07:37.472451 IP 147.182.152.46.22 > 104.171.50.84.65337: Flags [P.], seq 8564:8600, ack 1, win 501, options [nop,nop,TS val 3460357520 ecr 2410291665], length 36
22:07:37.472494 IP 147.182.152.46.22 > 104.171.50.84.65337: Flags [P.], seq 8600:8840, ack 1, win 501, options [nop,nop,TS val 3460357520 ecr 2410291665], length 240
22:07:37.472571 IP 147.182.152.46.22 > 104.171.50.84.65337: Flags [P.], seq 8840:9080, ack 1, win 501, options [nop,nop,TS val 3460357520 ecr 2410291665], length 240
22:07:37.472665 IP 147.182.152.46.22 > 104.171.50.84.65337: Flags [P.], seq 9080:9524, ack 1, win 501, options [nop,nop,TS val 3460357520 ecr 2410291665], length 444
22:07:37.472784 IP 147.182.152.46.22 > 104.171.50.84.65337: Flags [P.], seq 9524:10004, ack 1, win 501, options [nop,nop,TS val 3460357521 ecr 2410291665], length 480
22:07:37.472835 IP 147.182.152.46.22 > 104.171.50.84.65337: Flags [P.], seq 10004:10040, ack 1, win 501, options [nop,nop,TS val 3460357521 ecr 2410291665], length 36
22:07:37.472874 IP 147.182.152.46.22 > 104.171.50.84.65337: Flags [P.], seq 10040:10244, ack 1, win 501, options [nop,nop,TS val 3460357521 ecr 2410291665], length 204
22:07:37.472915 IP 147.182.152.46.22 > 104.171.50.84.65337: Flags [P.], seq 10244:10280, ack 1, win 501, options [nop,nop,TS val 3460357521 ecr 2410291665], length 36
22:07:37.472954 IP 147.182.152.46.22 > 104.171.50.84.65337: Flags [P.], seq 10280:10484, ack 1, win 501, options [nop,nop,TS val 3460357521 ecr 2410291665], length 204
22:07:37.472994 IP 147.182.152.46.22 > 104.171.50.84.65337: Flags [P.], seq 10484:10520, ack 1, win 501, options [nop,nop,TS val 3460357521 ecr 2410291665], length 36
22:07:37.473036 IP 147.182.152.46.22 > 104.171.50.84.65337: Flags [P.], seq 10520:10724, ack 1, win 501, options [nop,nop,TS val 3460357521 ecr 2410291665], length 204
22:07:37.473072 IP 147.182.152.46.22 > 104.171.50.84.65337: Flags [P.], seq 10724:10760, ack 1, win 501, options [nop,nop,TS val 3460357521 ecr 2410291665], length 36
22:07:37.473117 IP 147.182.152.46.22 > 104.171.50.84.65337: Flags [P.], seq 10760:10964, ack 1, win 501, options [nop,nop,TS val 3460357521 ecr 2410291665], length 204
22:07:37.473182 IP 147.182.152.46.22 > 104.171.50.84.65337: Flags [P.], seq 10964:11204, ack 1, win 501, options [nop,nop,TS val 3460357521 ecr 2410291665], length 240
22:07:37.473238 IP 147.182.152.46.22 > 104.171.50.84.65337: Flags [P.], seq 11204:11240, ack 1, win 501, options [nop,nop,TS val 3460357521 ecr 2410291665], length 36
22:07:37.473270 IP 147.182.152.46.22 > 104.171.50.84.65337: Flags [P.], seq 11240:11444, ack 1, win 501, options [nop,nop,TS val 3460357521 ecr 2410291665], length 204
22:07:37.473336 IP 147.182.152.46.22 > 104.171.50.84.65337: Flags [P.], seq 11444:11684, ack 1, win 501, options [nop,nop,TS val 3460357521 ecr 2410291665], length 240
22:07:37.473370 IP 147.182.152.46.22 > 104.171.50.84.65337: Flags [P.], seq 11684:11720, ack 1, win 501, options [nop,nop,TS val 3460357521 ecr 2410291665], length 36
22:07:37.473409 IP 147.182.152.46.22 > 104.171.50.84.65337: Flags [P.], seq 11720:11924, ack 1, win 501, options [nop,nop,TS val 3460357521 ecr 2410291665], length 204
22:07:37.473465 IP 147.182.152.46.22 > 104.171.50.84.65337: Flags [P.], seq 11924:12164, ack 1, win 501, options [nop,nop,TS val 3460357521 ecr 2410291665], length 240
22:07:37.473516 IP 147.182.152.46.22 > 104.171.50.84.65337: Flags [P.], seq 12164:12404, ack 1, win 501, options [nop,nop,TS val 3460357521 ecr 2410291665], length 240
22:07:37.473578 IP 147.182.152.46.22 > 104.171.50.84.65337: Flags [P.], seq 12404:12644, ack 1, win 501, options [nop,nop,TS val 3460357521 ecr 2410291665], length 240
22:07:37.473629 IP 147.182.152.46.22 > 104.171.50.84.65337: Flags [P.], seq 12644:12884, ack 1, win 501, options [nop,nop,TS val 3460357521 ecr 2410291665], length 240
22:07:37.473683 IP 147.182.152.46.22 > 104.171.50.84.65337: Flags [P.], seq 12884:12920, ack 1, win 501, options [nop,nop,TS val 3460357521 ecr 2410291665], length 36
22:07:37.473706 IP 147.182.152.46.22 > 104.171.50.84.65337: Flags [P.], seq 12920:13124, ack 1, win 501, options [nop,nop,TS val 3460357521 ecr 2410291665], length 204
22:07:37.485980 IP 104.171.50.84.65337 > 147.182.152.46.22: Flags [.], ack 13124, win 2048, options [nop,nop,TS val 2410291684 ecr 3460357521], length 0
22:07:37.486069 IP 147.182.152.46.22 > 104.171.50.84.65337: Flags [P.], seq 13124:15800, ack 1, win 501, options [nop,nop,TS val 3460357534 ecr 2410291684], length 2676
22:07:37.486249 IP 147.182.152.46.22 > 104.171.50.84.65337: Flags [P.], seq 15800:15988, ack 1, win 501, options [nop,nop,TS val 3460357534 ecr 2410291684], length 188
22:07:37.486313 IP 147.182.152.46.22 > 104.171.50.84.65337: Flags [P.], seq 15988:16024, ack 1, win 501, options [nop,nop,TS val 3460357534 ecr 2410291684], length 36
22:07:37.486338 IP 147.182.152.46.22 > 104.171.50.84.65337: Flags [P.], seq 16024:16228, ack 1, win 501, options [nop,nop,TS val 3460357534 ecr 2410291684], length 204
22:07:37.486394 IP 147.182.152.46.22 > 104.171.50.84.65337: Flags [P.], seq 16228:16468, ack 1, win 501, options [nop,nop,TS val 3460357534 ecr 2410291684], length 240
22:07:37.486457 IP 147.182.152.46.22 > 104.171.50.84.65337: Flags [P.], seq 16468:16504, ack 1, win 501, options [nop,nop,TS val 3460357534 ecr 2410291684], length 36
22:07:37.486482 IP 147.182.152.46.22 > 104.171.50.84.65337: Flags [P.], seq 16504:16708, ack 1, win 501, options [nop,nop,TS val 3460357534 ecr 2410291684], length 204
22:07:37.486511 IP 147.182.152.46.22 > 104.171.50.84.65337: Flags [P.], seq 16708:16744, ack 1, win 501, options [nop,nop,TS val 3460357534 ecr 2410291684], length 36
22:07:37.486549 IP 147.182.152.46.22 > 104.171.50.84.65337: Flags [P.], seq 16744:16948, ack 1, win 501, options [nop,nop,TS val 3460357534 ecr 2410291684], length 204
22:07:37.486588 IP 147.182.152.46.22 > 104.171.50.84.65337: Flags [P.], seq 16948:17188, ack 1, win 501, options [nop,nop,TS val 3460357534 ecr 2410291684], length 240
22:07:37.486628 IP 147.182.152.46.22 > 104.171.50.84.65337: Flags [P.], seq 17188:17224, ack 1, win 501, options [nop,nop,TS val 3460357534 ecr 2410291684], length 36
22:07:37.486666 IP 147.182.152.46.22 > 104.171.50.84.65337: Flags [P.], seq 17224:17428, ack 1, win 501, options [nop,nop,TS val 3460357534 ecr 2410291684], length 204
22:07:37.486702 IP 147.182.152.46.22 > 104.171.50.84.65337: Flags [P.], seq 17428:17464, ack 1, win 501, options [nop,nop,TS val 3460357534 ecr 2410291684], length 36
22:07:37.486740 IP 147.182.152.46.22 > 104.171.50.84.65337: Flags [P.], seq 17464:17668, ack 1, win 501, options [nop,nop,TS val 3460357534 ecr 2410291684], length 204
22:07:37.486776 IP 147.182.152.46.22 > 104.171.50.84.65337: Flags [P.], seq 17668:17704, ack 1, win 501, options [nop,nop,TS val 3460357535 ecr 2410291684], length 36
22:07:37.486810 IP 147.182.152.46.22 > 104.171.50.84.65337: Flags [P.], seq 17704:17908, ack 1, win 501, options [nop,nop,TS val 3460357535 ecr 2410291684], length 204
22:07:37.486843 IP 147.182.152.46.22 > 104.171.50.84.65337: Flags [P.], seq 17908:17944, ack 1, win 501, options [nop,nop,TS val 3460357535 ecr 2410291684], length 36
22:07:37.486886 IP 147.182.152.46.22 > 104.171.50.84.65337: Flags [P.], seq 17944:18184, ack 1, win 501, options [nop,nop,TS val 3460357535 ecr 2410291684], length 240
22:07:37.486929 IP 147.182.152.46.22 > 104.171.50.84.65337: Flags [P.], seq 18184:18424, ack 1, win 501, options [nop,nop,TS val 3460357535 ecr 2410291684], length 240
22:07:37.486986 IP 147.182.152.46.22 > 104.171.50.84.65337: Flags [P.], seq 18424:18664, ack 1, win 501, options [nop,nop,TS val 3460357535 ecr 2410291684], length 240
22:07:37.487034 IP 147.182.152.46.22 > 104.171.50.84.65337: Flags [P.], seq 18664:18904, ack 1, win 501, options [nop,nop,TS val 3460357535 ecr 2410291684], length 240
22:07:37.487087 IP 147.182.152.46.22 > 104.171.50.84.65337: Flags [P.], seq 18904:19108, ack 1, win 501, options [nop,nop,TS val 3460357535 ecr 2410291684], length 204
22:07:37.487132 IP 147.182.152.46.22 > 104.171.50.84.65337: Flags [P.], seq 19108:19348, ack 1, win 501, options [nop,nop,TS val 3460357535 ecr 2410291684], length 240
22:07:37.487187 IP 147.182.152.46.22 > 104.171.50.84.65337: Flags [P.], seq 19348:19384, ack 1, win 501, options [nop,nop,TS val 3460357535 ecr 2410291684], length 36
22:07:37.487217 IP 147.182.152.46.22 > 104.171.50.84.65337: Flags [P.], seq 19384:19588, ack 1, win 501, options [nop,nop,TS val 3460357535 ecr 2410291684], length 204
22:07:37.487296 IP 147.182.152.46.22 > 104.171.50.84.65337: Flags [P.], seq 19588:19828, ack 1, win 501, options [nop,nop,TS val 3460357535 ecr 2410291684], length 240
22:07:37.487339 IP 147.182.152.46.22 > 104.171.50.84.65337: Flags [P.], seq 19828:20068, ack 1, win 501, options [nop,nop,TS val 3460357535 ecr 2410291684], length 240
22:07:37.487382 IP 147.182.152.46.22 > 104.171.50.84.65337: Flags [P.], seq 20068:20308, ack 1, win 501, options [nop,nop,TS val 3460357535 ecr 2410291684], length 240
22:07:37.487425 IP 147.182.152.46.22 > 104.171.50.84.65337: Flags [P.], seq 20308:20344, ack 1, win 501, options [nop,nop,TS val 3460357535 ecr 2410291684], length 36
22:07:37.487470 IP 147.182.152.46.22 > 104.171.50.84.65337: Flags [P.], seq 20344:20584, ack 1, win 501, options [nop,nop,TS val 3460357535 ecr 2410291684], length 240
22:07:37.487512 IP 147.182.152.46.22 > 104.171.50.84.65337: Flags [P.], seq 20584:20824, ack 1, win 501, options [nop,nop,TS val 3460357535 ecr 2410291684], length 240
22:07:37.487555 IP 147.182.152.46.22 > 104.171.50.84.65337: Flags [P.], seq 20824:21064, ack 1, win 501, options [nop,nop,TS val 3460357535 ecr 2410291684], length 240
22:07:37.487598 IP 147.182.152.46.22 > 104.171.50.84.65337: Flags [P.], seq 21064:21304, ack 1, win 501, options [nop,nop,TS val 3460357535 ecr 2410291684], length 240
22:07:37.487641 IP 147.182.152.46.22 > 104.171.50.84.65337: Flags [P.], seq 21304:21544, ack 1, win 501, options [nop,nop,TS val 3460357535 ecr 2410291684], length 240
22:07:37.487685 IP 147.182.152.46.22 > 104.171.50.84.65337: Flags [P.], seq 21544:21748, ack 1, win 501, options [nop,nop,TS val 3460357535 ecr 2410291684], length 204
22:07:37.487727 IP 147.182.152.46.22 > 104.171.50.84.65337: Flags [P.], seq 21748:21988, ack 1, win 501, options [nop,nop,TS val 3460357535 ecr 2410291684], length 240
22:07:37.487777 IP 147.182.152.46.22 > 104.171.50.84.65337: Flags [P.], seq 21988:22024, ack 1, win 501, options [nop,nop,TS val 3460357536 ecr 2410291684], length 36
22:07:37.488021 IP 147.182.152.46.22 > 104.171.50.84.65337: Flags [P.], seq 22024:22228, ack 1, win 501, options [nop,nop,TS val 3460357536 ecr 2410291684], length 204
22:07:37.488085 IP 147.182.152.46.22 > 104.171.50.84.65337: Flags [P.], seq 22228:22264, ack 1, win 501, options [nop,nop,TS val 3460357536 ecr 2410291684], length 36
22:07:37.488104 IP 147.182.152.46.22 > 104.171.50.84.65337: Flags [P.], seq 22264:22468, ack 1, win 501, options [nop,nop,TS val 3460357536 ecr 2410291684], length 204
22:07:37.488153 IP 147.182.152.46.22 > 104.171.50.84.65337: Flags [P.], seq 22468:22504, ack 1, win 501, options [nop,nop,TS val 3460357536 ecr 2410291684], length 36
22:07:37.488190 IP 147.182.152.46.22 > 104.171.50.84.65337: Flags [P.], seq 22504:22708, ack 1, win 501, options [nop,nop,TS val 3460357536 ecr 2410291684], length 204
22:07:37.488229 IP 147.182.152.46.22 > 104.171.50.84.65337: Flags [P.], seq 22708:22744, ack 1, win 501, options [nop,nop,TS val 3460357536 ecr 2410291684], length 36
22:07:37.488273 IP 147.182.152.46.22 > 104.171.50.84.65337: Flags [P.], seq 22744:22984, ack 1, win 501, options [nop,nop,TS val 3460357536 ecr 2410291684], length 240
22:07:37.488313 IP 147.182.152.46.22 > 104.171.50.84.65337: Flags [P.], seq 22984:23224, ack 1, win 501, options [nop,nop,TS val 3460357536 ecr 2410291684], length 240
22:07:37.488355 IP 147.182.152.46.22 > 104.171.50.84.65337: Flags [P.], seq 23224:23428, ack 1, win 501, options [nop,nop,TS val 3460357536 ecr 2410291684], length 204
22:07:37.488400 IP 147.182.152.46.22 > 104.171.50.84.65337: Flags [P.], seq 23428:23668, ack 1, win 501, options [nop,nop,TS val 3460357536 ecr 2410291684], length 240
22:07:37.488444 IP 147.182.152.46.22 > 104.171.50.84.65337: Flags [P.], seq 23668:23908, ack 1, win 501, options [nop,nop,TS val 3460357536 ecr 2410291684], length 240
22:07:37.488487 IP 147.182.152.46.22 > 104.171.50.84.65337: Flags [P.], seq 23908:24148, ack 1, win 501, options [nop,nop,TS val 3460357536 ecr 2410291684], length 240
22:07:37.488531 IP 147.182.152.46.22 > 104.171.50.84.65337: Flags [P.], seq 24148:24388, ack 1, win 501, options [nop,nop,TS val 3460357536 ecr 2410291684], length 240
22:07:37.488575 IP 147.182.152.46.22 > 104.171.50.84.65337: Flags [P.], seq 24388:24628, ack 1, win 501, options [nop,nop,TS val 3460357536 ecr 2410291684], length 240
22:07:37.488619 IP 147.182.152.46.22 > 104.171.50.84.65337: Flags [P.], seq 24628:24868, ack 1, win 501, options [nop,nop,TS val 3460357536 ecr 2410291684], length 240
22:07:37.488662 IP 147.182.152.46.22 > 104.171.50.84.65337: Flags [P.], seq 24868:25108, ack 1, win 501, options [nop,nop,TS val 3460357536 ecr 2410291684], length 240
22:07:37.488704 IP 147.182.152.46.22 > 104.171.50.84.65337: Flags [P.], seq 25108:25144, ack 1, win 501, options [nop,nop,TS val 3460357536 ecr 2410291684], length 36
22:07:37.488749 IP 147.182.152.46.22 > 104.171.50.84.65337: Flags [P.], seq 25144:25348, ack 1, win 501, options [nop,nop,TS val 3460357536 ecr 2410291684], length 204
22:07:37.488788 IP 147.182.152.46.22 > 104.171.50.84.65337: Flags [P.], seq 25348:25588, ack 1, win 501, options [nop,nop,TS val 3460357537 ecr 2410291684], length 240
22:07:37.488827 IP 147.182.152.46.22 > 104.171.50.84.65337: Flags [P.], seq 25588:25624, ack 1, win 501, options [nop,nop,TS val 3460357537 ecr 2410291684], length 36
22:07:37.488869 IP 147.182.152.46.22 > 104.171.50.84.65337: Flags [P.], seq 25624:25864, ack 1, win 501, options [nop,nop,TS val 3460357537 ecr 2410291684], length 240
22:07:37.488913 IP 147.182.152.46.22 > 104.171.50.84.65337: Flags [P.], seq 25864:26104, ack 1, win 501, options [nop,nop,TS val 3460357537 ecr 2410291684], length 240
22:07:37.488955 IP 147.182.152.46.22 > 104.171.50.84.65337: Flags [P.], seq 26104:26308, ack 1, win 501, options [nop,nop,TS val 3460357537 ecr 2410291684], length 204
22:07:37.488996 IP 147.182.152.46.22 > 104.171.50.84.65337: Flags [P.], seq 26308:26344, ack 1, win 501, options [nop,nop,TS val 3460357537 ecr 2410291684], length 36
22:07:37.489037 IP 147.182.152.46.22 > 104.171.50.84.65337: Flags [P.], seq 26344:26584, ack 1, win 501, options [nop,nop,TS val 3460357537 ecr 2410291684], length 240
22:07:37.489079 IP 147.182.152.46.22 > 104.171.50.84.65337: Flags [P.], seq 26584:26824, ack 1, win 501, options [nop,nop,TS val 3460357537 ecr 2410291684], length 240
22:07:37.489121 IP 147.182.152.46.22 > 104.171.50.84.65337: Flags [P.], seq 26824:27064, ack 1, win 501, options [nop,nop,TS val 3460357537 ecr 2410291684], length 240
22:07:37.489162 IP 147.182.152.46.22 > 104.171.50.84.65337: Flags [P.], seq 27064:27268, ack 1, win 501, options [nop,nop,TS val 3460357537 ecr 2410291684], length 204
22:07:37.489206 IP 147.182.152.46.22 > 104.171.50.84.65337: Flags [P.], seq 27268:27508, ack 1, win 501, options [nop,nop,TS val 3460357537 ecr 2410291684], length 240
22:07:37.489247 IP 147.182.152.46.22 > 104.171.50.84.65337: Flags [P.], seq 27508:27544, ack 1, win 501, options [nop,nop,TS val 3460357537 ecr 2410291684], length 36
22:07:37.489288 IP 147.182.152.46.22 > 104.171.50.84.65337: Flags [P.], seq 27544:27748, ack 1, win 501, options [nop,nop,TS val 3460357537 ecr 2410291684], length 204
22:07:37.489332 IP 147.182.152.46.22 > 104.171.50.84.65337: Flags [P.], seq 27748:27784, ack 1, win 501, options [nop,nop,TS val 3460357537 ecr 2410291684], length 36
22:07:37.489371 IP 147.182.152.46.22 > 104.171.50.84.65337: Flags [P.], seq 27784:28024, ack 1, win 501, options [nop,nop,TS val 3460357537 ecr 2410291684], length 240
22:07:37.489412 IP 147.182.152.46.22 > 104.171.50.84.65337: Flags [P.], seq 28024:28264, ack 1, win 501, options [nop,nop,TS val 3460357537 ecr 2410291684], length 240
22:07:37.492076 IP 104.171.50.84.65337 > 147.182.152.46.22: Flags [P.], seq 1:37, ack 13124, win 2048, options [nop,nop,TS val 2410291685 ecr 3460357521], length 36
22:07:37.505678 IP 104.171.50.84.65337 > 147.182.152.46.22: Flags [.], ack 21748, win 2048, options [nop,nop,TS val 2410291697 ecr 3460357535], length 0
22:07:37.505679 IP 104.171.50.84.65337 > 147.182.152.46.22: Flags [.], ack 25588, win 1988, options [nop,nop,TS val 2410291699 ecr 3460357537], length 0
22:07:37.505679 IP 104.171.50.84.65337 > 147.182.152.46.22: Flags [.], ack 25588, win 2048, options [nop,nop,TS val 2410291699 ecr 3460357537], length 0
22:07:37.505772 IP 147.182.152.46.22 > 104.171.50.84.65337: Flags [P.], seq 28264:33132, ack 37, win 501, options [nop,nop,TS val 3460357553 ecr 2410291685], length 4868
22:07:37.505957 IP 147.182.152.46.22 > 104.171.50.84.65337: Flags [P.], seq 33132:33320, ack 37, win 501, options [nop,nop,TS val 3460357554 ecr 2410291699], length 188
22:07:37.506017 IP 147.182.152.46.22 > 104.171.50.84.65337: Flags [P.], seq 33320:33544, ack 37, win 501, options [nop,nop,TS val 3460357554 ecr 2410291699], length 224
22:07:37.506068 IP 147.182.152.46.22 > 104.171.50.84.65337: Flags [P.], seq 33544:33580, ack 37, win 501, options [nop,nop,TS val 3460357554 ecr 2410291699], length 36
22:07:37.506080 IP 147.182.152.46.22 > 104.171.50.84.65337: Flags [P.], seq 33580:33768, ack 37, win 501, options [nop,nop,TS val 3460357554 ecr 2410291699], length 188
22:07:37.506125 IP 147.182.152.46.22 > 104.171.50.84.65337: Flags [P.], seq 33768:33804, ack 37, win 501, options [nop,nop,TS val 3460357554 ecr 2410291699], length 36
22:07:37.506162 IP 147.182.152.46.22 > 104.171.50.84.65337: Flags [P.], seq 33804:34008, ack 37, win 501, options [nop,nop,TS val 3460357554 ecr 2410291699], length 204
22:07:37.506199 IP 147.182.152.46.22 > 104.171.50.84.65337: Flags [P.], seq 34008:34044, ack 37, win 501, options [nop,nop,TS val 3460357554 ecr 2410291699], length 36
22:07:37.506241 IP 147.182.152.46.22 > 104.171.50.84.65337: Flags [P.], seq 34044:34248, ack 37, win 501, options [nop,nop,TS val 3460357554 ecr 2410291699], length 204
22:07:37.506287 IP 147.182.152.46.22 > 104.171.50.84.65337: Flags [P.], seq 34248:34796, ack 37, win 501, options [nop,nop,TS val 3460357554 ecr 2410291699], length 548
22:07:37.506323 IP 147.182.152.46.22 > 104.171.50.84.65337: Flags [P.], seq 34796:35008, ack 37, win 501, options [nop,nop,TS val 3460357554 ecr 2410291699], length 212
22:07:37.506364 IP 147.182.152.46.22 > 104.171.50.84.65337: Flags [P.], seq 35008:35380, ack 37, win 501, options [nop,nop,TS val 3460357554 ecr 2410291699], length 372
22:07:37.506406 IP 147.182.152.46.22 > 104.171.50.84.65337: Flags [P.], seq 35380:35584, ack 37, win 501, options [nop,nop,TS val 3460357554 ecr 2410291699], length 204
22:07:37.506449 IP 147.182.152.46.22 > 104.171.50.84.65337: Flags [P.], seq 35584:35964, ack 37, win 501, options [nop,nop,TS val 3460357554 ecr 2410291699], length 380
22:07:37.506492 IP 147.182.152.46.22 > 104.171.50.84.65337: Flags [P.], seq 35964:36168, ack 37, win 501, options [nop,nop,TS val 3460357554 ecr 2410291699], length 204
22:07:37.506533 IP 147.182.152.46.22 > 104.171.50.84.65337: Flags [P.], seq 36168:36716, ack 37, win 501, options [nop,nop,TS val 3460357554 ecr 2410291699], length 548
22:07:37.506624 IP 147.182.152.46.22 > 104.171.50.84.65337: Flags [P.], seq 36716:36920, ack 37, win 501, options [nop,nop,TS val 3460357554 ecr 2410291699], length 204
22:07:37.506680 IP 147.182.152.46.22 > 104.171.50.84.65337: Flags [P.], seq 36920:37124, ack 37, win 501, options [nop,nop,TS val 3460357554 ecr 2410291699], length 204
22:07:37.506843 IP 147.182.152.46.22 > 104.171.50.84.65337: Flags [P.], seq 37124:37328, ack 37, win 501, options [nop,nop,TS val 3460357555 ecr 2410291699], length 204
22:07:37.506980 IP 147.182.152.46.22 > 104.171.50.84.65337: Flags [P.], seq 37328:37532, ack 37, win 501, options [nop,nop,TS val 3460357555 ecr 2410291699], length 204
22:07:37.507057 IP 147.182.152.46.22 > 104.171.50.84.65337: Flags [P.], seq 37532:37744, ack 37, win 501, options [nop,nop,TS val 3460357555 ecr 2410291699], length 212
22:07:37.507146 IP 147.182.152.46.22 > 104.171.50.84.65337: Flags [P.], seq 37744:37948, ack 37, win 501, options [nop,nop,TS val 3460357555 ecr 2410291699], length 204
22:07:37.507244 IP 147.182.152.46.22 > 104.171.50.84.65337: Flags [P.], seq 37948:38152, ack 37, win 501, options [nop,nop,TS val 3460357555 ecr 2410291699], length 204
22:07:37.507311 IP 147.182.152.46.22 > 104.171.50.84.65337: Flags [P.], seq 38152:38356, ack 37, win 501, options [nop,nop,TS val 3460357555 ecr 2410291699], length 204
22:07:37.507369 IP 147.182.152.46.22 > 104.171.50.84.65337: Flags [P.], seq 38356:38560, ack 37, win 501, options [nop,nop,TS val 3460357555 ecr 2410291699], length 204
22:07:37.507422 IP 147.182.152.46.22 > 104.171.50.84.65337: Flags [P.], seq 38560:38764, ack 37, win 501, options [nop,nop,TS val 3460357555 ecr 2410291699], length 204
22:07:37.507470 IP 147.182.152.46.22 > 104.171.50.84.65337: Flags [P.], seq 38764:38968, ack 37, win 501, options [nop,nop,TS val 3460357555 ecr 2410291699], length 204
22:07:37.507528 IP 147.182.152.46.22 > 104.171.50.84.65337: Flags [P.], seq 38968:39172, ack 37, win 501, options [nop,nop,TS val 3460357555 ecr 2410291699], length 204
22:07:37.507590 IP 147.182.152.46.22 > 104.171.50.84.65337: Flags [P.], seq 39172:39376, ack 37, win 501, options [nop,nop,TS val 3460357555 ecr 2410291699], length 204
22:07:37.507650 IP 147.182.152.46.22 > 104.171.50.84.65337: Flags [P.], seq 39376:39580, ack 37, win 501, options [nop,nop,TS val 3460357555 ecr 2410291699], length 204
22:07:37.507706 IP 147.182.152.46.22 > 104.171.50.84.65337: Flags [P.], seq 39580:39784, ack 37, win 501, options [nop,nop,TS val 3460357555 ecr 2410291699], length 204
22:07:37.508034 IP 147.182.152.46.22 > 104.171.50.84.65337: Flags [P.], seq 39784:39988, ack 37, win 501, options [nop,nop,TS val 3460357556 ecr 2410291699], length 204
22:07:37.508168 IP 147.182.152.46.22 > 104.171.50.84.65337: Flags [P.], seq 39988:40192, ack 37, win 501, options [nop,nop,TS val 3460357556 ecr 2410291699], length 204
22:07:37.508388 IP 147.182.152.46.22 > 104.171.50.84.65337: Flags [P.], seq 40192:40396, ack 37, win 501, options [nop,nop,TS val 3460357556 ecr 2410291699], length 204
22:07:37.508538 IP 147.182.152.46.22 > 104.171.50.84.65337: Flags [P.], seq 40396:40600, ack 37, win 501, options [nop,nop,TS val 3460357556 ecr 2410291699], length 204
22:07:37.508603 IP 147.182.152.46.22 > 104.171.50.84.65337: Flags [P.], seq 40600:40804, ack 37, win 501, options [nop,nop,TS val 3460357556 ecr 2410291699], length 204
22:07:37.508718 IP 147.182.152.46.22 > 104.171.50.84.65337: Flags [P.], seq 40804:41008, ack 37, win 501, options [nop,nop,TS val 3460357556 ecr 2410291699], length 204
22:07:37.508800 IP 147.182.152.46.22 > 104.171.50.84.65337: Flags [P.], seq 41008:41212, ack 37, win 501, options [nop,nop,TS val 3460357557 ecr 2410291699], length 204
22:07:37.508860 IP 147.182.152.46.22 > 104.171.50.84.65337: Flags [P.], seq 41212:41416, ack 37, win 501, options [nop,nop,TS val 3460357557 ecr 2410291699], length 204
22:07:37.508920 IP 147.182.152.46.22 > 104.171.50.84.65337: Flags [P.], seq 41416:41620, ack 37, win 501, options [nop,nop,TS val 3460357557 ecr 2410291699], length 204
22:07:37.508980 IP 147.182.152.46.22 > 104.171.50.84.65337: Flags [P.], seq 41620:41824, ack 37, win 501, options [nop,nop,TS val 3460357557 ecr 2410291699], length 204
22:07:37.509039 IP 147.182.152.46.22 > 104.171.50.84.65337: Flags [P.], seq 41824:42028, ack 37, win 501, options [nop,nop,TS val 3460357557 ecr 2410291699], length 204
22:07:37.509100 IP 147.182.152.46.22 > 104.171.50.84.65337: Flags [P.], seq 42028:42232, ack 37, win 501, options [nop,nop,TS val 3460357557 ecr 2410291699], length 204
22:07:37.509175 IP 147.182.152.46.22 > 104.171.50.84.65337: Flags [P.], seq 42232:42436, ack 37, win 501, options [nop,nop,TS val 3460357557 ecr 2410291699], length 204
22:07:37.509234 IP 147.182.152.46.22 > 104.171.50.84.65337: Flags [P.], seq 42436:42640, ack 37, win 501, options [nop,nop,TS val 3460357557 ecr 2410291699], length 204
22:07:37.509294 IP 147.182.152.46.22 > 104.171.50.84.65337: Flags [P.], seq 42640:42844, ack 37, win 501, options [nop,nop,TS val 3460357557 ecr 2410291699], length 204
22:07:37.509357 IP 147.182.152.46.22 > 104.171.50.84.65337: Flags [P.], seq 42844:43048, ack 37, win 501, options [nop,nop,TS val 3460357557 ecr 2410291699], length 204
22:07:37.509426 IP 147.182.152.46.22 > 104.171.50.84.65337: Flags [P.], seq 43048:43252, ack 37, win 501, options [nop,nop,TS val 3460357557 ecr 2410291699], length 204
22:07:37.509488 IP 147.182.152.46.22 > 104.171.50.84.65337: Flags [P.], seq 43252:43456, ack 37, win 501, options [nop,nop,TS val 3460357557 ecr 2410291699], length 204
22:07:37.509554 IP 147.182.152.46.22 > 104.171.50.84.65337: Flags [P.], seq 43456:43660, ack 37, win 501, options [nop,nop,TS val 3460357557 ecr 2410291699], length 204
22:07:37.509616 IP 147.182.152.46.22 > 104.171.50.84.65337: Flags [P.], seq 43660:43864, ack 37, win 501, options [nop,nop,TS val 3460357557 ecr 2410291699], length 204
22:07:37.509675 IP 147.182.152.46.22 > 104.171.50.84.65337: Flags [P.], seq 43864:44068, ack 37, win 501, options [nop,nop,TS val 3460357557 ecr 2410291699], length 204
22:07:37.509745 IP 147.182.152.46.22 > 104.171.50.84.65337: Flags [P.], seq 44068:44272, ack 37, win 501, options [nop,nop,TS val 3460357557 ecr 2410291699], length 204
22:07:37.509818 IP 147.182.152.46.22 > 104.171.50.84.65337: Flags [P.], seq 44272:44476, ack 37, win 501, options [nop,nop,TS val 3460357558 ecr 2410291699], length 204
22:07:37.509881 IP 147.182.152.46.22 > 104.171.50.84.65337: Flags [P.], seq 44476:44680, ack 37, win 501, options [nop,nop,TS val 3460357558 ecr 2410291699], length 204
22:07:37.509942 IP 147.182.152.46.22 > 104.171.50.84.65337: Flags [P.], seq 44680:44884, ack 37, win 501, options [nop,nop,TS val 3460357558 ecr 2410291699], length 204
22:07:37.510006 IP 147.182.152.46.22 > 104.171.50.84.65337: Flags [P.], seq 44884:45088, ack 37, win 501, options [nop,nop,TS val 3460357558 ecr 2410291699], length 204
22:07:37.510063 IP 147.182.152.46.22 > 104.171.50.84.65337: Flags [P.], seq 45088:45292, ack 37, win 501, options [nop,nop,TS val 3460357558 ecr 2410291699], length 204
22:07:37.510119 IP 147.182.152.46.22 > 104.171.50.84.65337: Flags [P.], seq 45292:45496, ack 37, win 501, options [nop,nop,TS val 3460357558 ecr 2410291699], length 204
22:07:37.510186 IP 147.182.152.46.22 > 104.171.50.84.65337: Flags [P.], seq 45496:45700, ack 37, win 501, options [nop,nop,TS val 3460357558 ecr 2410291699], length 204
22:07:37.510247 IP 147.182.152.46.22 > 104.171.50.84.65337: Flags [P.], seq 45700:45904, ack 37, win 501, options [nop,nop,TS val 3460357558 ecr 2410291699], length 204
22:07:37.510306 IP 147.182.152.46.22 > 104.171.50.84.65337: Flags [P.], seq 45904:46108, ack 37, win 501, options [nop,nop,TS val 3460357558 ecr 2410291699], length 204
22:07:37.510369 IP 147.182.152.46.22 > 104.171.50.84.65337: Flags [P.], seq 46108:46312, ack 37, win 501, options [nop,nop,TS val 3460357558 ecr 2410291699], length 204
22:07:37.510428 IP 147.182.152.46.22 > 104.171.50.84.65337: Flags [P.], seq 46312:46516, ack 37, win 501, options [nop,nop,TS val 3460357558 ecr 2410291699], length 204
22:07:37.510494 IP 147.182.152.46.22 > 104.171.50.84.65337: Flags [P.], seq 46516:46720, ack 37, win 501, options [nop,nop,TS val 3460357558 ecr 2410291699], length 204
22:07:37.510560 IP 147.182.152.46.22 > 104.171.50.84.65337: Flags [P.], seq 46720:46924, ack 37, win 501, options [nop,nop,TS val 3460357558 ecr 2410291699], length 204
22:07:37.510626 IP 147.182.152.46.22 > 104.171.50.84.65337: Flags [P.], seq 46924:47128, ack 37, win 501, options [nop,nop,TS val 3460357558 ecr 2410291699], length 204
22:07:37.510691 IP 147.182.152.46.22 > 104.171.50.84.65337: Flags [P.], seq 47128:47332, ack 37, win 501, options [nop,nop,TS val 3460357558 ecr 2410291699], length 204
22:07:37.510759 IP 147.182.152.46.22 > 104.171.50.84.65337: Flags [P.], seq 47332:47536, ack 37, win 501, options [nop,nop,TS val 3460357558 ecr 2410291699], length 204
22:07:37.510824 IP 147.182.152.46.22 > 104.171.50.84.65337: Flags [P.], seq 47536:47740, ack 37, win 501, options [nop,nop,TS val 3460357559 ecr 2410291699], length 204
22:07:37.510889 IP 147.182.152.46.22 > 104.171.50.84.65337: Flags [P.], seq 47740:47944, ack 37, win 501, options [nop,nop,TS val 3460357559 ecr 2410291699], length 204
22:07:37.510963 IP 147.182.152.46.22 > 104.171.50.84.65337: Flags [P.], seq 47944:48148, ack 37, win 501, options [nop,nop,TS val 3460357559 ecr 2410291699], length 204
22:07:37.511027 IP 147.182.152.46.22 > 104.171.50.84.65337: Flags [P.], seq 48148:48352, ack 37, win 501, options [nop,nop,TS val 3460357559 ecr 2410291699], length 204
22:07:37.511088 IP 147.182.152.46.22 > 104.171.50.84.65337: Flags [P.], seq 48352:48556, ack 37, win 501, options [nop,nop,TS val 3460357559 ecr 2410291699], length 204
22:07:37.511151 IP 147.182.152.46.22 > 104.171.50.84.65337: Flags [P.], seq 48556:48760, ack 37, win 501, options [nop,nop,TS val 3460357559 ecr 2410291699], length 204
22:07:37.511217 IP 147.182.152.46.22 > 104.171.50.84.65337: Flags [P.], seq 48760:48964, ack 37, win 501, options [nop,nop,TS val 3460357559 ecr 2410291699], length 204
22:07:37.511284 IP 147.182.152.46.22 > 104.171.50.84.65337: Flags [P.], seq 48964:49168, ack 37, win 501, options [nop,nop,TS val 3460357559 ecr 2410291699], length 204
22:07:37.511351 IP 147.182.152.46.22 > 104.171.50.84.65337: Flags [P.], seq 49168:49372, ack 37, win 501, options [nop,nop,TS val 3460357559 ecr 2410291699], length 204
22:07:37.511410 IP 147.182.152.46.22 > 104.171.50.84.65337: Flags [P.], seq 49372:49576, ack 37, win 501, options [nop,nop,TS val 3460357559 ecr 2410291699], length 204
22:07:37.511473 IP 147.182.152.46.22 > 104.171.50.84.65337: Flags [P.], seq 49576:49780, ack 37, win 501, options [nop,nop,TS val 3460357559 ecr 2410291699], length 204
22:07:37.511537 IP 147.182.152.46.22 > 104.171.50.84.65337: Flags [P.], seq 49780:49984, ack 37, win 501, options [nop,nop,TS val 3460357559 ecr 2410291699], length 204
22:07:37.511605 IP 147.182.152.46.22 > 104.171.50.84.65337: Flags [P.], seq 49984:50188, ack 37, win 501, options [nop,nop,TS val 3460357559 ecr 2410291699], length 204
22:07:37.511670 IP 147.182.152.46.22 > 104.171.50.84.65337: Flags [P.], seq 50188:50392, ack 37, win 501, options [nop,nop,TS val 3460357559 ecr 2410291699], length 204
22:07:37.511739 IP 147.182.152.46.22 > 104.171.50.84.65337: Flags [P.], seq 50392:50596, ack 37, win 501, options [nop,nop,TS val 3460357559 ecr 2410291699], length 204
22:07:37.511794 IP 147.182.152.46.22 > 104.171.50.84.65337: Flags [P.], seq 50596:50800, ack 37, win 501, options [nop,nop,TS val 3460357560 ecr 2410291699], length 204
22:07:37.512040 IP 147.182.152.46.22 > 104.171.50.84.65337: Flags [P.], seq 50800:51004, ack 37, win 501, options [nop,nop,TS val 3460357560 ecr 2410291699], length 204
22:07:37.512102 IP 147.182.152.46.22 > 104.171.50.84.65337: Flags [P.], seq 51004:51208, ack 37, win 501, options [nop,nop,TS val 3460357560 ecr 2410291699], length 204
22:07:37.512169 IP 147.182.152.46.22 > 104.171.50.84.65337: Flags [P.], seq 51208:51412, ack 37, win 501, options [nop,nop,TS val 3460357560 ecr 2410291699], length 204
22:07:37.512288 IP 147.182.152.46.22 > 104.171.50.84.65337: Flags [P.], seq 51412:51616, ack 37, win 501, options [nop,nop,TS val 3460357560 ecr 2410291699], length 204
22:07:37.512347 IP 147.182.152.46.22 > 104.171.50.84.65337: Flags [P.], seq 51616:51820, ack 37, win 501, options [nop,nop,TS val 3460357560 ecr 2410291699], length 204
22:07:37.512522 IP 147.182.152.46.22 > 104.171.50.84.65337: Flags [P.], seq 51820:52024, ack 37, win 501, options [nop,nop,TS val 3460357560 ecr 2410291699], length 204
22:07:37.512586 IP 147.182.152.46.22 > 104.171.50.84.65337: Flags [P.], seq 52024:52228, ack 37, win 501, options [nop,nop,TS val 3460357560 ecr 2410291699], length 204
22:07:37.512638 IP 147.182.152.46.22 > 104.171.50.84.65337: Flags [P.], seq 52228:52432, ack 37, win 501, options [nop,nop,TS val 3460357560 ecr 2410291699], length 204
22:07:37.512691 IP 147.182.152.46.22 > 104.171.50.84.65337: Flags [P.], seq 52432:52636, ack 37, win 501, options [nop,nop,TS val 3460357560 ecr 2410291699], length 204
22:07:37.512749 IP 147.182.152.46.22 > 104.171.50.84.65337: Flags [P.], seq 52636:52840, ack 37, win 501, options [nop,nop,TS val 3460357560 ecr 2410291699], length 204
22:07:37.512807 IP 147.182.152.46.22 > 104.171.50.84.65337: Flags [P.], seq 52840:53044, ack 37, win 501, options [nop,nop,TS val 3460357561 ecr 2410291699], length 204
22:07:37.512872 IP 147.182.152.46.22 > 104.171.50.84.65337: Flags [P.], seq 53044:53248, ack 37, win 501, options [nop,nop,TS val 3460357561 ecr 2410291699], length 204
22:07:37.512929 IP 147.182.152.46.22 > 104.171.50.84.65337: Flags [P.], seq 53248:53452, ack 37, win 501, options [nop,nop,TS val 3460357561 ecr 2410291699], length 204
22:07:37.512987 IP 147.182.152.46.22 > 104.171.50.84.65337: Flags [P.], seq 53452:53656, ack 37, win 501, options [nop,nop,TS val 3460357561 ecr 2410291699], length 204
22:07:37.513353 IP 147.182.152.46.22 > 104.171.50.84.65337: Flags [P.], seq 53656:53860, ack 37, win 501, options [nop,nop,TS val 3460357561 ecr 2410291699], length 204
22:07:37.513432 IP 147.182.152.46.22 > 104.171.50.84.65337: Flags [P.], seq 53860:54064, ack 37, win 501, options [nop,nop,TS val 3460357561 ecr 2410291699], length 204
22:07:37.513489 IP 147.182.152.46.22 > 104.171.50.84.65337: Flags [P.], seq 54064:54268, ack 37, win 501, options [nop,nop,TS val 3460357561 ecr 2410291699], length 204
22:07:37.513783 IP 147.182.152.46.22 > 104.171.50.84.65337: Flags [P.], seq 54268:54472, ack 37, win 501, options [nop,nop,TS val 3460357562 ecr 2410291699], length 204
22:07:37.513892 IP 147.182.152.46.22 > 104.171.50.84.65337: Flags [P.], seq 54472:54676, ack 37, win 501, options [nop,nop,TS val 3460357562 ecr 2410291699], length 204
22:07:37.513959 IP 147.182.152.46.22 > 104.171.50.84.65337: Flags [P.], seq 54676:54880, ack 37, win 501, options [nop,nop,TS val 3460357562 ecr 2410291699], length 204
22:07:37.514074 IP 147.182.152.46.22 > 104.171.50.84.65337: Flags [P.], seq 54880:55084, ack 37, win 501, options [nop,nop,TS val 3460357562 ecr 2410291699], length 204
22:07:37.514250 IP 147.182.152.46.22 > 104.171.50.84.65337: Flags [P.], seq 55084:55288, ack 37, win 501, options [nop,nop,TS val 3460357562 ecr 2410291699], length 204
22:07:37.514416 IP 147.182.152.46.22 > 104.171.50.84.65337: Flags [P.], seq 55288:55492, ack 37, win 501, options [nop,nop,TS val 3460357562 ecr 2410291699], length 204
22:07:37.514486 IP 147.182.152.46.22 > 104.171.50.84.65337: Flags [P.], seq 55492:55696, ack 37, win 501, options [nop,nop,TS val 3460357562 ecr 2410291699], length 204
22:07:37.514548 IP 147.182.152.46.22 > 104.171.50.84.65337: Flags [P.], seq 55696:55900, ack 37, win 501, options [nop,nop,TS val 3460357562 ecr 2410291699], length 204
22:07:37.514618 IP 147.182.152.46.22 > 104.171.50.84.65337: Flags [P.], seq 55900:56104, ack 37, win 501, options [nop,nop,TS val 3460357562 ecr 2410291699], length 204
22:07:37.542719 IP 104.171.50.84.65337 > 147.182.152.46.22: Flags [.], ack 32608, win 1980, options [nop,nop,TS val 2410291716 ecr 3460357553], length 0
22:07:37.542720 IP 104.171.50.84.65337 > 147.182.152.46.22: Flags [.], ack 32608, win 2048, options [nop,nop,TS val 2410291716 ecr 3460357553], length 0
22:07:37.542720 IP 104.171.50.84.65337 > 147.182.152.46.22: Flags [.], ack 38764, win 2048, options [nop,nop,TS val 2410291717 ecr 3460357555], length 0
22:07:37.542720 IP 104.171.50.84.65337 > 147.182.152.46.22: Flags [.], ack 44068, win 2048, options [nop,nop,TS val 2410291719 ecr 3460357557], length 0
22:07:37.542720 IP 104.171.50.84.65337 > 147.182.152.46.22: Flags [.], ack 48964, win 1971, options [nop,nop,TS val 2410291721 ecr 3460357559], length 0
22:07:37.542720 IP 104.171.50.84.65337 > 147.182.152.46.22: Flags [.], ack 48964, win 2048, options [nop,nop,TS val 2410291721 ecr 3460357559], length 0
22:07:37.542720 IP 104.171.50.84.65337 > 147.182.152.46.22: Flags [.], ack 54064, win 2048, options [nop,nop,TS val 2410291723 ecr 3460357561], length 0
22:07:37.542720 IP 104.171.50.84.65337 > 147.182.152.46.22: Flags [.], ack 54676, win 2048, options [nop,nop,TS val 2410291724 ecr 3460357562], length 0
22:07:37.542814 IP 147.182.152.46.22 > 104.171.50.84.65337: Flags [P.], seq 56104:56308, ack 37, win 501, options [nop,nop,TS val 3460357591 ecr 2410291716], length 204
22:07:37.542905 IP 104.171.50.84.65337 > 147.182.152.46.22: Flags [.], ack 56104, win 2048, options [nop,nop,TS val 2410291725 ecr 3460357562], length 0
22:07:37.543149 IP 147.182.152.46.22 > 104.171.50.84.65337: Flags [P.], seq 56308:57904, ack 37, win 501, options [nop,nop,TS val 3460357591 ecr 2410291725], length 1596
22:07:37.543217 IP 147.182.152.46.22 > 104.171.50.84.65337: Flags [P.], seq 57904:58116, ack 37, win 501, options [nop,nop,TS val 3460357591 ecr 2410291725], length 212
22:07:37.543283 IP 147.182.152.46.22 > 104.171.50.84.65337: Flags [P.], seq 58116:58320, ack 37, win 501, options [nop,nop,TS val 3460357591 ecr 2410291725], length 204
22:07:37.543347 IP 147.182.152.46.22 > 104.171.50.84.65337: Flags [P.], seq 58320:58524, ack 37, win 501, options [nop,nop,TS val 3460357591 ecr 2410291725], length 204
22:07:37.543422 IP 147.182.152.46.22 > 104.171.50.84.65337: Flags [P.], seq 58524:58728, ack 37, win 501, options [nop,nop,TS val 3460357591 ecr 2410291725], length 204
22:07:37.543479 IP 147.182.152.46.22 > 104.171.50.84.65337: Flags [P.], seq 58728:58932, ack 37, win 501, options [nop,nop,TS val 3460357591 ecr 2410291725], length 204
22:07:37.543546 IP 147.182.152.46.22 > 104.171.50.84.65337: Flags [P.], seq 58932:59136, ack 37, win 501, options [nop,nop,TS val 3460357591 ecr 2410291725], length 204
22:07:37.543597 IP 147.182.152.46.22 > 104.171.50.84.65337: Flags [P.], seq 59136:59340, ack 37, win 501, options [nop,nop,TS val 3460357591 ecr 2410291725], length 204
22:07:37.543659 IP 147.182.152.46.22 > 104.171.50.84.65337: Flags [P.], seq 59340:59544, ack 37, win 501, options [nop,nop,TS val 3460357591 ecr 2410291725], length 204
22:07:37.543710 IP 147.182.152.46.22 > 104.171.50.84.65337: Flags [P.], seq 59544:59748, ack 37, win 501, options [nop,nop,TS val 3460357591 ecr 2410291725], length 204
22:07:37.543768 IP 147.182.152.46.22 > 104.171.50.84.65337: Flags [P.], seq 59748:59952, ack 37, win 501, options [nop,nop,TS val 3460357592 ecr 2410291725], length 204
22:07:37.544007 IP 147.182.152.46.22 > 104.171.50.84.65337: Flags [P.], seq 59952:60156, ack 37, win 501, options [nop,nop,TS val 3460357592 ecr 2410291725], length 204
22:07:37.544094 IP 147.182.152.46.22 > 104.171.50.84.65337: Flags [P.], seq 60156:60360, ack 37, win 501, options [nop,nop,TS val 3460357592 ecr 2410291725], length 204
22:07:37.544174 IP 147.182.152.46.22 > 104.171.50.84.65337: Flags [P.], seq 60360:60564, ack 37, win 501, options [nop,nop,TS val 3460357592 ecr 2410291725], length 204
22:07:37.544233 IP 147.182.152.46.22 > 104.171.50.84.65337: Flags [P.], seq 60564:60768, ack 37, win 501, options [nop,nop,TS val 3460357592 ecr 2410291725], length 204
22:07:37.544289 IP 147.182.152.46.22 > 104.171.50.84.65337: Flags [P.], seq 60768:60972, ack 37, win 501, options [nop,nop,TS val 3460357592 ecr 2410291725], length 204
22:07:37.544346 IP 147.182.152.46.22 > 104.171.50.84.65337: Flags [P.], seq 60972:61176, ack 37, win 501, options [nop,nop,TS val 3460357592 ecr 2410291725], length 204
22:07:37.544398 IP 147.182.152.46.22 > 104.171.50.84.65337: Flags [P.], seq 61176:61380, ack 37, win 501, options [nop,nop,TS val 3460357592 ecr 2410291725], length 204
22:07:37.544450 IP 147.182.152.46.22 > 104.171.50.84.65337: Flags [P.], seq 61380:61584, ack 37, win 501, options [nop,nop,TS val 3460357592 ecr 2410291725], length 204
22:07:37.544504 IP 147.182.152.46.22 > 104.171.50.84.65337: Flags [P.], seq 61584:61788, ack 37, win 501, options [nop,nop,TS val 3460357592 ecr 2410291725], length 204
22:07:37.544553 IP 147.182.152.46.22 > 104.171.50.84.65337: Flags [P.], seq 61788:61992, ack 37, win 501, options [nop,nop,TS val 3460357592 ecr 2410291725], length 204
22:07:37.544607 IP 147.182.152.46.22 > 104.171.50.84.65337: Flags [P.], seq 61992:62196, ack 37, win 501, options [nop,nop,TS val 3460357592 ecr 2410291725], length 204
22:07:37.544656 IP 147.182.152.46.22 > 104.171.50.84.65337: Flags [P.], seq 62196:62400, ack 37, win 501, options [nop,nop,TS val 3460357592 ecr 2410291725], length 204
22:07:37.544706 IP 147.182.152.46.22 > 104.171.50.84.65337: Flags [P.], seq 62400:62604, ack 37, win 501, options [nop,nop,TS val 3460357592 ecr 2410291725], length 204
22:07:37.544754 IP 147.182.152.46.22 > 104.171.50.84.65337: Flags [P.], seq 62604:62808, ack 37, win 501, options [nop,nop,TS val 3460357592 ecr 2410291725], length 204
22:07:37.544802 IP 147.182.152.46.22 > 104.171.50.84.65337: Flags [P.], seq 62808:63012, ack 37, win 501, options [nop,nop,TS val 3460357593 ecr 2410291725], length 204
win 500, options [nop,nop,TS val 3460358086 ecr 2410292232], length 0
^C
6354 packets captured
6354 packets received by filter
0 packets dropped by kernel